2026-01-01 18:06:16,660 [INFO] ======================================================================
2026-01-01 18:06:16,661 [INFO] E2E AGENTIC WORKFLOW TEST
2026-01-01 18:06:16,661 [INFO] ======================================================================
2026-01-01 18:06:16,661 [INFO] 
[STEP 1] Creating new learner...
2026-01-01 18:06:16,725 [INFO]   Created learner: learner-e39c40ed
2026-01-01 18:06:16,725 [INFO] 
[STEP 2] Checking initial project state...
2026-01-01 18:06:16,755 [INFO]   Project: proj-f4b1
2026-01-01 18:06:16,755 [INFO]   Total tasks: 46
2026-01-01 18:06:16,755 [INFO]   Completed: 0
2026-01-01 18:06:16,755 [INFO]   In Progress: 0
2026-01-01 18:06:16,755 [INFO]   Blocked: 0
2026-01-01 18:06:16,755 [INFO]   Objectives: 0/71
2026-01-01 18:06:16,755 [INFO] 
[STEP 3] Getting ready work (unblocked tasks)...
2026-01-01 18:06:16,793 [INFO]   Total ready: 20
2026-01-01 18:06:16,793 [INFO]   Message: Found 20 tasks ready (0 in progress).
2026-01-01 18:06:16,793 [INFO]     [1] proj-f4b1.1.1: Understand the mission... (status: open, type: task)
2026-01-01 18:06:16,793 [INFO]     [2] proj-f4b1.2.1: Discover what tables exist... (status: open, type: task)
2026-01-01 18:06:16,793 [INFO]     [3] proj-f4b1.3.1: Find unique water source types... (status: open, type: task)
2026-01-01 18:06:16,793 [INFO]     [4] proj-f4b1.4.1: Find locations with long queue times... (status: open, type: task)
2026-01-01 18:06:16,793 [INFO]     [5] proj-f4b1.5.1: Explore the water_quality table... (status: open, type: task)
2026-01-01 18:06:16,793 [INFO]     [6] proj-f4b1.6.1: Explore the well_pollution table... (status: open, type: task)
2026-01-01 18:06:16,793 [INFO]     [7] proj-f4b1: Maji Ndogo Water Crisis - Part 1: Beginn... (status: open, type: project)
2026-01-01 18:06:16,793 [INFO]     [8] proj-f4b1.1: Introduction... (status: open, type: epic)
2026-01-01 18:06:16,793 [INFO]     [9] proj-f4b1.2: Get to Know Our Data... (status: open, type: epic)
2026-01-01 18:06:16,793 [INFO]     [10] proj-f4b1.3: Dive into Water Sources... (status: open, type: epic)
2026-01-01 18:06:16,793 [INFO] 
[STEP 4] Selecting first epic to complete...
2026-01-01 18:06:16,794 [INFO]   Epic: proj-f4b1.1 - Introduction
2026-01-01 18:06:16,794 [INFO]   Direct children (tasks): 1
2026-01-01 18:06:16,794 [INFO]     - proj-f4b1.1.1: Understand the mission...
2026-01-01 18:06:16,794 [INFO] 
[STEP 5] Working through first task and its subtasks...
2026-01-01 18:06:16,795 [INFO]   Task: proj-f4b1.1.1 - Understand the mission
2026-01-01 18:06:16,795 [INFO]   Subtasks: 3
2026-01-01 18:06:16,795 [INFO] 
  --- Processing subtask: proj-f4b1.1.1.1 ---
2026-01-01 18:06:16,795 [INFO]       Title: Read President Naledi's message...
2026-01-01 18:06:16,796 [INFO]       Initial status: open
2026-01-01 18:06:16,825 [INFO]       After start_task: in_progress
2026-01-01 18:06:16,837 [INFO]       Submission: attempt #1, passed: True
2026-01-01 18:06:16,838 [INFO]       Can close: True
2026-01-01 18:06:16,843 [INFO]       Auto-closed subtask: status = closed
2026-01-01 18:06:16,843 [INFO] 
  --- Processing subtask: proj-f4b1.1.1.2 ---
2026-01-01 18:06:16,843 [INFO]       Title: Meet your mentor Chidi Kunto...
2026-01-01 18:06:16,844 [INFO]       Initial status: open
2026-01-01 18:06:16,862 [INFO]       After start_task: in_progress
2026-01-01 18:06:16,869 [INFO]       Submission: attempt #1, passed: True
2026-01-01 18:06:16,869 [INFO]       Can close: True
2026-01-01 18:06:16,873 [INFO]       Auto-closed subtask: status = closed
2026-01-01 18:06:16,873 [INFO] 
  --- Processing subtask: proj-f4b1.1.1.3 ---
2026-01-01 18:06:16,873 [INFO]       Title: Review the 5 tasks ahead...
2026-01-01 18:06:16,874 [INFO]       Initial status: open
2026-01-01 18:06:16,893 [INFO]       After start_task: in_progress
2026-01-01 18:06:16,900 [INFO]       Submission: attempt #1, passed: True
2026-01-01 18:06:16,900 [INFO]       Can close: True
2026-01-01 18:06:16,905 [INFO]       Auto-closed subtask: status = closed
2026-01-01 18:06:16,905 [INFO] 
[STEP 6] Attempting to close parent task...
2026-01-01 18:06:16,905 [INFO]   Subtask proj-f4b1.1.1.1: closed
2026-01-01 18:06:16,906 [INFO]   Subtask proj-f4b1.1.1.2: closed
2026-01-01 18:06:16,906 [INFO]   Subtask proj-f4b1.1.1.3: closed
2026-01-01 18:06:16,906 [INFO]   All subtasks closed: True
2026-01-01 18:06:16,906 [INFO]   Can close task proj-f4b1.1.1: True
2026-01-01 18:06:16,914 [INFO]   Closed task proj-f4b1.1.1: status = closed
2026-01-01 18:06:16,914 [INFO] 
[STEP 7] Checking epic closure requirements...
2026-01-01 18:06:16,915 [INFO]   proj-f4b1.1.1: closed
2026-01-01 18:06:16,915 [INFO]   Tasks closed: 1/1
2026-01-01 18:06:16,916 [INFO]   Can close epic: True
2026-01-01 18:06:16,916 [INFO] 
[STEP 8] Completing remaining tasks in epic...
2026-01-01 18:06:16,916 [INFO]   proj-f4b1.1.1: Already closed, skipping
2026-01-01 18:06:16,916 [INFO] 
[STEP 9] Closing the epic...
2026-01-01 18:06:16,919 [INFO]   Can close epic now: True
2026-01-01 18:06:16,924 [INFO]   Epic closed: status = closed
2026-01-01 18:06:16,924 [INFO] 
[STEP 10] Testing work on epic 2...
2026-01-01 18:06:16,924 [INFO]   Epic 2: proj-f4b1.2 - Get to Know Our Data
2026-01-01 18:06:16,924 [INFO]   First task: proj-f4b1.2.1 - Discover what tables exist...
2026-01-01 18:06:16,925 [INFO]   Is blocked: False
2026-01-01 18:06:16,944 [INFO]   Start result: success=True, status=in_progress
2026-01-01 18:06:16,944 [INFO] 
[STEP 11] Testing go_back (reopen closed task)...
2026-01-01 18:06:16,944 [INFO]   Task to reopen: proj-f4b1.1.1.1
2026-01-01 18:06:16,944 [INFO]   Current status: closed
2026-01-01 18:06:16,947 [INFO]   After reopen: open
2026-01-01 18:06:16,954 [INFO]   Closed again: closed
2026-01-01 18:06:16,954 [INFO] 
[STEP 12] Final progress check...
2026-01-01 18:06:16,956 [INFO]   Total tasks: 46
2026-01-01 18:06:16,956 [INFO]   Completed: 4
2026-01-01 18:06:16,956 [INFO]   Completion: 8.7%
2026-01-01 18:06:16,956 [INFO]   In Progress: 1
2026-01-01 18:06:16,956 [INFO]   Blocked: 0
2026-01-01 18:06:16,956 [INFO]   Objectives achieved: 3/71
2026-01-01 18:06:16,956 [INFO] 
[STEP 13] Getting ready work after completing epic...
2026-01-01 18:06:16,965 [INFO]   Total ready: 10
2026-01-01 18:06:16,965 [INFO]   In progress count: 1
2026-01-01 18:06:16,965 [INFO]     [1] proj-f4b1.2.1: Discover what tables exist... (status: in_progress)
2026-01-01 18:06:16,965 [INFO]     [2] proj-f4b1.3.1: Find unique water source types... (status: open)
2026-01-01 18:06:16,965 [INFO]     [3] proj-f4b1.4.1: Find locations with long queue times... (status: open)
2026-01-01 18:06:16,965 [INFO]     [4] proj-f4b1.5.1: Explore the water_quality table... (status: open)
2026-01-01 18:06:16,965 [INFO]     [5] proj-f4b1.6.1: Explore the well_pollution table... (status: open)
2026-01-01 18:06:16,965 [INFO] 
[STEP 14] Checking for orphan in_progress tasks...
2026-01-01 18:06:16,968 [INFO]   Tasks currently in_progress: 1
2026-01-01 18:06:16,968 [INFO]     - proj-f4b1.2.1: Discover what tables exist...
2026-01-01 18:06:16,969 [INFO] 
======================================================================
2026-01-01 18:06:16,969 [INFO] TEST SUMMARY
2026-01-01 18:06:16,969 [INFO] ======================================================================
2026-01-01 18:06:16,969 [INFO]   Learner: learner-e39c40ed
2026-01-01 18:06:16,969 [INFO]   Project: proj-f4b1
2026-01-01 18:06:16,969 [INFO]   Epic completed: proj-f4b1.1
2026-01-01 18:06:16,969 [INFO]   Final completion: 4/46 (8.7%)
2026-01-01 18:06:16,969 [INFO]   Orphan in_progress tasks: 1
2026-01-01 18:06:16,969 [INFO]   Log file: logs/e2e_workflow_20260101_180616.log
2026-01-01 18:06:16,969 [INFO] ======================================================================
